{
  "operatorId": "alpha-telecom",
  "name": "Alpha Telecom",
  "logo": {
    "light": "/assets/branding/alpha-telecom/logo-light.svg",
    "dark": "/assets/branding/alpha-telecom/logo-dark.svg",
    "favicon": "/assets/branding/alpha-telecom/favicon.ico"
  },
  "colors": {
    "primary": {
      "50": "#fff7ed",
      "100": "#ffedd5",
      "200": "#fed7aa",
      "300": "#fdba74",
      "400": "#fb923c",
      "500": "#f97316",
      "600": "#ea580c",
      "700": "#c2410c",
      "800": "#9a3412",
      "900": "#7c2d12"
    },
    "secondary": {
      "50": "#faf5ff",
      "100": "#f3e8ff",
      "200": "#e9d5ff",
      "300": "#d8b4fe",
      "400": "#c084fc",
      "500": "#a855f7",
      "600": "#9333ea",
      "700": "#7e22ce",
      "800": "#6b21a8",
      "900": "#581c87"
    },
    "accent": {
      "50": "#ecfeff",
      "100": "#cffafe",
      "200": "#a5f3fc",
      "300": "#67e8f9",
      "400": "#22d3ee",
      "500": "#06b6d4",
      "600": "#0891b2",
      "700": "#0e7490",
      "800": "#155e75",
      "900": "#164e63"
    },
    "success": {
      "500": "#10b981"
    },
    "warning": {
      "500": "#f59e0b"
    },
    "error": {
      "500": "#ef4444"
    },
    "neutral": {
      "50": "#fafafa",
      "100": "#f5f5f4",
      "200": "#e7e5e4",
      "300": "#d6d3d1",
      "400": "#a8a29e",
      "500": "#78716c",
      "600": "#57534e",
      "700": "#44403c",
      "800": "#292524",
      "900": "#1c1917"
    }
  },
  "typography": {
    "fontFamily": {
      "sans": "\"Plus Jakarta Sans\", -apple-system, BlinkMacSystemFont, \"Segoe UI\", Roboto, sans-serif",
      "mono": "\"JetBrains Mono\", \"Fira Code\", monospace"
    },
    "headings": {
      "fontFamily": "\"Plus Jakarta Sans\", -apple-system, BlinkMacSystemFont, \"Segoe UI\", Roboto, sans-serif",
      "fontWeight": {
        "h1": "800",
        "h2": "700",
        "h3": "700",
        "h4": "600",
        "h5": "600",
        "h6": "600"
      }
    }
  },
  "semanticTokens": {
    "text": {
      "primary": "#1c1917",
      "secondary": "#57534e",
      "disabled": "#a8a29e",
      "inverse": "#fafafa"
    },
    "background": {
      "primary": "#ffffff",
      "secondary": "#f5f5f4",
      "tertiary": "#e7e5e4"
    },
    "border": {
      "default": "#e7e5e4",
      "focus": "#f97316"
    }
  },
  "cssVariables": {
    "--border-radius-sm": "0.375rem",
    "--border-radius-default": "0.5rem",
    "--border-radius-lg": "1rem",
    "--shadow-sm": "0 1px 3px 0 rgb(249 115 22 / 0.1), 0 1px 2px -1px rgb(249 115 22 / 0.1)",
    "--shadow-default": "0 4px 6px -1px rgb(249 115 22 / 0.1), 0 2px 4px -2px rgb(249 115 22 / 0.1)",
    "--shadow-md": "0 10px 15px -3px rgb(249 115 22 / 0.1), 0 4px 6px -4px rgb(249 115 22 / 0.1)"
  },
  "version": "1.0.0",
  "lastUpdated": "2026-03-12T11:00:00Z"
}
