{
  "operatorId": "default",
  "name": "MyTelco Default",
  "logo": {
    "light": "/assets/branding/default/logo-light.svg",
    "dark": "/assets/branding/default/logo-dark.svg",
    "favicon": "/assets/branding/default/favicon.ico"
  },
  "colors": {
    "primary": {
      "50": "#e6f2ff",
      "100": "#b3d9ff",
      "200": "#80bfff",
      "300": "#4da6ff",
      "400": "#1a8cff",
      "500": "#0073e6",
      "600": "#005ab3",
      "700": "#004080",
      "800": "#00264d",
      "900": "#000d1a"
    },
    "secondary": {
      "50": "#f0f9ff",
      "100": "#dbeafe",
      "200": "#bfdbfe",
      "300": "#93c5fd",
      "400": "#60a5fa",
      "500": "#3b82f6",
      "600": "#2563eb",
      "700": "#1d4ed8",
      "800": "#1e40af",
      "900": "#1e3a8a"
    },
    "accent": {
      "50": "#f0fdf4",
      "100": "#dcfce7",
      "200": "#bbf7d0",
      "300": "#86efac",
      "400": "#4ade80",
      "500": "#22c55e",
      "600": "#16a34a",
      "700": "#15803d",
      "800": "#166534",
      "900": "#14532d"
    },
    "success": {
      "500": "#16a34a"
    },
    "warning": {
      "500": "#f59e0b"
    },
    "error": {
      "500": "#ef4444"
    },
    "neutral": {
      "50": "#fafafa",
      "100": "#f4f4f5",
      "200": "#e4e4e7",
      "300": "#d4d4d8",
      "400": "#a1a1aa",
      "500": "#71717a",
      "600": "#52525b",
      "700": "#3f3f46",
      "800": "#27272a",
      "900": "#18181b"
    }
  },
  "typography": {
    "fontFamily": {
      "sans": "\"Inter\", -apple-system, BlinkMacSystemFont, \"Segoe UI\", Roboto, sans-serif",
      "mono": "\"Fira Code\", \"Monaco\", \"Consolas\", monospace"
    },
    "headings": {
      "fontFamily": "\"Inter\", -apple-system, BlinkMacSystemFont, \"Segoe UI\", Roboto, sans-serif",
      "fontWeight": {
        "h1": "700",
        "h2": "700",
        "h3": "600",
        "h4": "600",
        "h5": "600",
        "h6": "500"
      }
    }
  },
  "semanticTokens": {
    "text": {
      "primary": "#18181b",
      "secondary": "#52525b",
      "disabled": "#a1a1aa",
      "inverse": "#fafafa"
    },
    "background": {
      "primary": "#ffffff",
      "secondary": "#f4f4f5",
      "tertiary": "#e4e4e7"
    },
    "border": {
      "default": "#e4e4e7",
      "focus": "#0073e6"
    }
  },
  "cssVariables": {
    "--border-radius-sm": "0.25rem",
    "--border-radius-default": "0.375rem",
    "--border-radius-lg": "0.75rem",
    "--shadow-sm": "0 1px 2px 0 rgb(0 0 0 / 0.05)",
    "--shadow-default": "0 1px 3px 0 rgb(0 0 0 / 0.1), 0 1px 2px -1px rgb(0 0 0 / 0.1)",
    "--shadow-md": "0 4px 6px -1px rgb(0 0 0 / 0.1), 0 2px 4px -2px rgb(0 0 0 / 0.1)"
  },
  "version": "1.0.0",
  "lastUpdated": "2026-03-12T11:00:00Z"
}
